{
  "schema_version": 1,
  "device_id": "esp32_01",
  "event_uuid": "esp32-aabbccddeeff:b00000007-1234abcd:00000001",
  "payload_sha256": "9f86d081884c7d659a2feaa0c55ad015a3bf4f1b2b0b822cd15d6c15b0f00a08",
  "status": "committed",
  "reason_code": null,
  "event_id": 123,
  "committed_at": "2026-10-25T12:00:00.250Z",
  "retry_after_ms": null,
  "issued_at": "2026-10-25T12:00:00.260Z"
}
